smartctl 7.1 2019-12-30 r5022 [x86_64-linux-5.4.0-60-generic] (local build)
Copyright (C) 2002-19, Bruce Allen, Christian Franke, www.smartmontools.org

=== START OF INFORMATION SECTION ===
Model Family:     Silicon Motion based SSDs
Device Model:     TS256GSSD230S
Serial Number:    F604674015
LU WWN Device Id: 5 7c3548 189ab53df
Firmware Version: R0427BNR
User Capacity:    256,060,514,304 bytes [256 GB]
Sector Size:      512 bytes logical/physical
Rotation Rate:    Solid State Device
Form Factor:      2.5 inches
Device is:        In smartctl database [for details use: -P show]
ATA Version is:   ACS-3 T13/2161-D revision 5
SATA Version is:  SATA 3.3, 6.0 Gb/s (current: 6.0 Gb/s)
Local Time is:    Thu Jan 14 11:46:32 2021 +06
SMART support is: Available - device has SMART capability.
SMART support is: Enabled

=== START OF READ SMART DATA SECTION ===
SMART overall-health self-assessment test result: PASSED

General SMART Values:
Offline data collection status:  (0x80)	Offline data collection activity
					was never started.
					Auto Offline Data Collection: Enabled.
Self-test execution status:      (   0)	The previous self-test routine completed
					without error or no self-test has ever 
					been run.
Total time to complete Offline 
data collection: 		(    0) seconds.
Offline data collection
capabilities: 			 (0x7b) SMART execute Offline immediate.
					Auto Offline data collection on/off support.
					Suspend Offline collection upon new
					command.
					Offline surface scan supported.
					Self-test supported.
					Conveyance Self-test supported.
					Selective Self-test supported.
SMART capabilities:            (0x0002)	Does not save SMART data before
					entering power-saving mode.
					Supports SMART auto save timer.
Error logging capability:        (0x01)	Error logging supported.
					General Purpose Logging supported.
Short self-test routine 
recommended polling time: 	 (   2) minutes.
Extended self-test routine
recommended polling time: 	 (  30) minutes.
Conveyance self-test routine
recommended polling time: 	 (   2) minutes.

SMART Attributes Data Structure revision number: 16
Vendor Specific SMART Attributes with Thresholds:
ID# ATTRIBUTE_NAME          FLAG     VALUE WORST THRESH TYPE      UPDATED  WHEN_FAILED RAW_VALUE
  1 Raw_Read_Error_Rate     0x0000   100   100   000    Old_age   Offline      -       0
  5 Reallocated_Sector_Ct   0x0000   100   100   000    Old_age   Offline      -       0
  9 Power_On_Hours          0x0000   100   100   000    Old_age   Offline      -       1119
 12 Power_Cycle_Count       0x0000   100   100   000    Old_age   Offline      -       1437
148 Total_SLC_Erase_Ct      0x0000   100   100   000    Old_age   Offline      -       7202
149 Max_SLC_Erase_Ct        0x0000   100   100   000    Old_age   Offline      -       500
150 Min_SLC_Erase_Ct        0x0000   100   100   000    Old_age   Offline      -       443
151 Average_SLC_Erase_Ct    0x0000   100   100   000    Old_age   Offline      -       480
159 Unkn_SiliconMotion_Attr 0x0000   100   100   000    Old_age   Offline      -       0
160 Uncorrectable_Error_Cnt 0x0000   100   100   000    Old_age   Offline      -       0
161 Valid_Spare_Block_Cnt   0x0000   100   100   000    Old_age   Offline      -       34
163 Initial_Bad_Block_Count 0x0000   100   100   000    Old_age   Offline      -       25
164 Total_Erase_Count       0x0000   100   100   000    Old_age   Offline      -       47158
165 Max_Erase_Count         0x0000   100   100   000    Old_age   Offline      -       135
166 Min_Erase_Count         0x0000   100   100   000    Old_age   Offline      -       35
167 Average_Erase_Count     0x0000   100   100   000    Old_age   Offline      -       102
168 Max_Erase_Count_of_Spec 0x0000   100   100   000    Old_age   Offline      -       1500
169 Remaining_Lifetime_Perc 0x0000   100   100   000    Old_age   Offline      -       94
177 Wear_Leveling_Count     0x0000   100   100   050    Old_age   Offline      -       7
181 Program_Fail_Cnt_Total  0x0000   100   100   000    Old_age   Offline      -       0
182 Erase_Fail_Count_Total  0x0000   100   100   000    Old_age   Offline      -       0
192 Power-Off_Retract_Count 0x0000   100   100   000    Old_age   Offline      -       603
194 Temperature_Celsius     0x0000   100   100   000    Old_age   Offline      -       38
195 Hardware_ECC_Recovered  0x0000   100   100   000    Old_age   Offline      -       0
196 Reallocated_Event_Count 0x0000   100   100   016    Old_age   Offline      -       0
199 UDMA_CRC_Error_Count    0x0000   100   100   050    Old_age   Offline      -       1
232 Available_Reservd_Space 0x0000   100   100   000    Old_age   Offline      -       100
241 Host_Writes_32MiB       0x0000   100   100   000    Old_age   Offline      -       107941
242 Host_Reads_32MiB        0x0000   100   100   000    Old_age   Offline      -       83748
245 TLC_Writes_32MiB        0x0000   100   100   000    Old_age   Offline      -       848844

SMART Error Log Version: 1
No Errors Logged

SMART Self-test log structure revision number 1
No self-tests have been logged.  [To run self-tests, use: smartctl -t]

SMART Selective self-test log data structure revision number 1
 SPAN  MIN_LBA  MAX_LBA  CURRENT_TEST_STATUS
    1        0        0  Not_testing
    2        0        0  Not_testing
    3        0        0  Not_testing
    4        0        0  Not_testing
    5        0        0  Completed [00% left] (0-65535)
Selective self-test flags (0x0):
  After scanning selected spans, do NOT read-scan remainder of disk.
If Selective self-test is pending on power-up, resume after 0 minute delay.

